<?xml version="1.0" encoding="UTF-8"?>
<!DOCTYPE list SYSTEM "armors.dtd">
<list>
<item id='9200' name="Shadow Item - Jester Hat - Firework">
  <for>
    <add val='0' order='0x10' stat='pDef'/>
  </for>
</item>
<item id='9201' name="Shadow Item - Wizard Hat - Firework">
  <for>
    <add val='0' order='0x10' stat='pDef'/>
  </for>
</item>
<item id='9202' name="Shadow Item - Dapper Cap - Firework">
  <for>
    <add val='0' order='0x10' stat='pDef'/>
  </for>
</item>
<item id='9203' name="Shadow Item - Romantic Chapeau - Firework">
  <for>
    <add val='0' order='0x10' stat='pDef'/>
  </for>
</item>
<item id='9204' name="Shadow Item - Iron Circlet - Firework">
  <for>
    <add val='0' order='0x10' stat='pDef'/>
  </for>
</item>
<item id='9208' name="Phantom Mask (Event)">
  <for>
    <add val='0' order='0x10' stat='pDef'/>
  </for>
</item>
</list>