<?xml version="1.0" encoding="UTF-8"?>
<!DOCTYPE list SYSTEM "armors.dtd">
<list>
<item id='9100' name="Shadow Item: Magestic Boots">
  <for>
    <add val='49' order='0x10' stat='pDef'/>
    <enchant val='0' order='0x0C' stat='pDef'/>
  </for>
</item>
<item id='9101' name="Shadow Item: Majestic Robe">
  <for>
    <add val='147' order='0x10' stat='pDef'/>
    <add val='718' order='0x40' stat='maxMp'/>
    <enchant val='0' order='0x0C' stat='pDef'/>
  </for>
</item>
<item id='9102' name="Shadow Item: Magestic Gauntlet">
  <for>
    <add val='49' order='0x10' stat='pDef'/>
    <enchant val='0' order='0x0C' stat='pDef'/>
  </for>
</item>
<item id='9103' name="Shadow Item: Magestic Boots">
  <for>
    <add val='49' order='0x10' stat='pDef'/>
    <enchant val='0' order='0x0C' stat='pDef'/>
  </for>
</item>
<item id='9128' name="Shadow Item: Mithril Gauntlet">
  <for>
    <add val='36' order='0x10' stat='pDef'/>
    <enchant val='0' order='0x0C' stat='pDef'/>
  </for>
</item>
<item id='9138' name="Santa's Hat">
  <for>
    <add val='0' order='0x10' stat='pDef'/>
  </for>
</item>
<item id='9145' name="Little Angel Wings (Event)">
  <for>
    <add val='0' order='0x10' stat='pDef'/>
  </for>
</item>
<item id='9158' name="Golden Circlet of Redemption">
  <for>
    <add val='0' order='0x10' stat='pDef'/>
  </for>
</item>
<item id='9159' name="Silver Circlet of Salvation">
  <for>
    <add val='0' order='0x10' stat='pDef'/>
  </for>
</item>
<item id='9160' name="Pig Wrangler's Cap">
  <for>
    <add val='0' order='0x10' stat='pDef'/>
  </for>
</item>
<item id='9177' name="Shadow Item - Teddy Bear Hat - Resurrection">
  <for>
    <add val='0' order='0x10' stat='pDef'/>
  </for>
</item>
<item id='9178' name="Shadow Item - Piggy Hat - Resurrection">
  <for>
    <add val='0' order='0x10' stat='pDef'/>
  </for>
</item>
<item id='9179' name="Shadow Item - Jester Hat - Resurrection">
  <for>
    <add val='0' order='0x10' stat='pDef'/>
  </for>
</item>
<item id='9180' name="Shadow Item - Wizard Hat - Resurrection">
  <for>
    <add val='0' order='0x10' stat='pDef'/>
  </for>
</item>
<item id='9181' name="Shadow Item - Dapper Cap - Resurrection">
  <for>
    <add val='0' order='0x10' stat='pDef'/>
  </for>
</item>
<item id='9182' name="Shadow Item - Romantic Chapeau - Resurrection">
  <for>
    <add val='0' order='0x10' stat='pDef'/>
  </for>
</item>
<item id='9183' name="Shadow Item - Iron Circlet - Resurrection">
  <for>
    <add val='0' order='0x10' stat='pDef'/>
  </for>
</item>
<item id='9184' name="Shadow Item - Teddy Bear Hat - Escape">
  <for>
    <add val='0' order='0x10' stat='pDef'/>
  </for>
</item>
<item id='9185' name="Shadow Item - Piggy Hat - Escape">
  <for>
    <add val='0' order='0x10' stat='pDef'/>
  </for>
</item>
<item id='9186' name="Shadow Item - Jester Hat - Escap">
  <for>
    <add val='0' order='0x10' stat='pDef'/>
  </for>
</item>
<item id='9187' name="Shadow Item - Wizard Hat - Escape">
  <for>
    <add val='0' order='0x10' stat='pDef'/>
  </for>
</item>
<item id='9188' name="Shadow Item - Dapper Cap - Escap">
  <for>
    <add val='0' order='0x10' stat='pDef'/>
  </for>
</item>
<item id='9189' name="Shadow Item - Romantic Chapeau - Escape">
  <for>
    <add val='0' order='0x10' stat='pDef'/>
  </for>
</item>
<item id='9190' name="Shadow Item - Iron Circlet - Escap">
  <for>
    <add val='0' order='0x10' stat='pDef'/>
  </for>
</item>
<item id='9191' name="Shadow Item - Teddy Bear Hat - Big Head">
  <for>
    <add val='0' order='0x10' stat='pDef'/>
  </for>
</item>
<item id='9192' name="Shadow Item - Piggy Hat - Big Head">
  <for>
    <add val='0' order='0x10' stat='pDef'/>
  </for>
</item>
<item id='9193' name="Shadow Item - Jester Hat - Big Head">
  <for>
    <add val='0' order='0x10' stat='pDef'/>
  </for>
</item>
<item id='9194' name="Shadow Item - Wizard Hat - Big Head">
  <for>
    <add val='0' order='0x10' stat='pDef'/>
  </for>
</item>
<item id='9195' name="Shadow Item - Dapper Cap - Big Head">
  <for>
    <add val='0' order='0x10' stat='pDef'/>
  </for>
</item>
<item id='9196' name="Shadow Item - Romantic Chapeau - Big Head">
  <for>
    <add val='0' order='0x10' stat='pDef'/>
  </for>
</item>
<item id='9197' name="Shadow Item - Iron Circlet - Big Head">
  <for>
    <add val='0' order='0x10' stat='pDef'/>
  </for>
</item>
<item id='9198' name="Shadow Item - Teddy Bear Hat - Firework">
  <for>
    <add val='0' order='0x10' stat='pDef'/>
  </for>
</item>
<item id='9199' name="Shadow Item - Piggy Hat - Firework">
  <for>
    <add val='0' order='0x10' stat='pDef'/>
  </for>
</item>
</list>